{
  "$schema": "../../System-References/Schemas/stage-5-context.schema.json",
  "format_version": "2.0",
  "artifact_id": "ARTIFACT-S5-CONTEXT",
  "artifact_type": "stage_context",
  "stage": "Stage 5",
  "status": "ready_for_stage_6",
  "selected_stack": {
    "stack_decision_id": "STACK-003",
    "frontend": {
      "framework": "Next.js App Router",
      "language": "TypeScript",
      "ui_runtime": "React",
      "styling": "Tailwind CSS with shadcn/ui-compatible component primitives",
      "state": "Server Components and server actions for standard flows; client state only for interactive discovery/catalog workflows"
    },
    "backend": {
      "framework": "Next.js route handlers and server actions",
      "runtime": "Node.js LTS",
      "language": "TypeScript",
      "api_style": "Route Handler -> Domain Service -> Repository -> Prisma for REST-style JSON endpoints and app-owned mutations",
      "background_jobs": "Separate TypeScript BullMQ worker on Redis for all long-running tasks"
    },
    "monorepo": {
      "workspace_tooling": "pnpm workspaces",
      "apps": [
        "apps/web",
        "apps/worker"
      ],
      "packages": {
        "packages/domain": "Domain services, use cases, orchestration, business logic, and service interfaces consumed by web and worker.",
        "packages/ai": "AI Capability Router, provider adapter interfaces, provider implementations, request/response normalization, and provider health checks.",
        "packages/scrapers": "Playwright website discovery, navigation tree extraction, PDF/OCR import connectors, and raw artifact collection.",
        "packages/shared": "Shared utilities, config helpers, logging, errors, constants, and cross-cutting primitives.",
        "packages/validation": "Deterministic validation rules, duplicate checks, SKU/price/category rules, and candidate-to-catalog import gates.",
        "packages/types": "Shared TypeScript types, DTOs, schemas, queue payloads, and API contracts."
      }
    },
    "domain_service_layer": {
      "request_flow": "Route Handler / Server Action -> Domain Service -> Repository -> Prisma -> PostgreSQL",
      "worker_flow": "BullMQ Processor -> Domain Service -> Repository -> Prisma -> PostgreSQL",
      "rule": "Business logic lives in domain services and validation package, not directly inside route handlers, server actions, or queue processors."
    },
    "database": {
      "primary": "PostgreSQL",
      "orm_or_query_layer": "Prisma",
      "search": "PostgreSQL full-text search for MVP; external search deferred until scale evidence exists",
      "migration_strategy": "Prisma migrations"
    },
    "storage": {
      "provider": "Backblaze B2",
      "usage": "PDF uploads, generated PDFs/PNGs, import snapshots, rendered DOM snapshots when retained"
    },
    "authentication": {
      "provider_or_strategy": "Clerk Organizations",
      "tenant_model": "Workspace maps to Clerk organization and application workspace_id",
      "authorization": "Application-enforced RBAC with workspace_owner for MVP"
    },
    "hosting_and_deployment": {
      "web_and_api": "Vercel",
      "workers": "Fly.io TypeScript worker service with Playwright runtime",
      "database": "Neon PostgreSQL",
      "redis": "Upstash Redis",
      "object_storage": "Backblaze B2",
      "observability": "Sentry plus structured logs and queue/job metrics"
    },
    "testing_stack": {
      "unit": "Vitest",
      "route_integration": "Vitest against route handlers/server actions through domain services",
      "worker_integration": "Vitest against BullMQ processors through domain services",
      "e2e": "Playwright",
      "database": "Prisma test database migrations",
      "security": "tenant-isolation integration tests and credential handling checks"
    },
    "package_manager": "pnpm",
    "ai_and_external_services": [
      {
        "service": "AI Capability Router",
        "status": "stable interface for all AI integrations"
      },
      {
        "service": "OpenAI-compatible provider adapter",
        "status": "MVP default adapter"
      },
      {
        "service": "Ollama provider adapter",
        "status": "local model option"
      },
      {
        "service": "Anthropic provider adapter",
        "status": "post-MVP adapter unless required earlier"
      },
      {
        "service": "Google/Gemini provider adapter",
        "status": "post-MVP adapter unless required earlier"
      },
      {
        "service": "Tesseract OCR",
        "status": "MVP OCR fallback for PDFs"
      }
    ],
    "pipeline_architecture": {
      "scraping_pipeline": "External source -> connector/scraper -> raw import artifact -> normalized source record -> Discovery Session candidate seed",
      "ai_enrichment_pipeline": "Normalized source record or catalog candidate -> AI Capability Router -> Provider Adapter -> enrichment result -> validation -> candidate/catalog update",
      "separation_rule": "Scraping collects and normalizes source data; AI enrichment is independently repeatable and can re-enrich stored normalized source records without re-scraping.",
      "re_enrichment_support": "Persist normalized source records and import artifacts with version/source hashes so users can rerun enrichment after changing provider, prompt, capability route, or validation rules."
    },
    "rationale": "A Next.js full-stack monorepo with a separate BullMQ worker is the simplest scalable architecture: route handlers and server actions stay thin, all business logic is centralized in shared domain services, workers reuse the same domain services, scraping and AI enrichment remain independent pipelines, and the AI Capability Router/Provider Adapter interface remains stable for all AI integrations.",
    "rejected_alternatives": [
      {
        "alternative": "Next.js-only including long-running workers",
        "reason": "Too risky for Playwright/OCR/AI jobs; workers must scale and run independently."
      },
      {
        "alternative": "Python/FastAPI backend",
        "reason": "Adds a second language while frontend, Playwright, and worker ecosystem remain TypeScript-heavy."
      },
      {
        "alternative": "Microservices from day one",
        "reason": "Over-engineered before scale evidence; monorepo packages plus separate worker are enough."
      },
      {
        "alternative": "External search service for MVP",
        "reason": "Unnecessary until catalog scale proves PostgreSQL full-text insufficient."
      }
    ],
    "risks": [
      "RISK-001",
      "RISK-005",
      "RISK-010",
      "RISK-012",
      "RISK-015",
      "ARCH-RISK-001",
      "ARCH-RISK-002"
    ]
  },
  "stage_contract_profile": {
    "profile_id": "PROFILE-SOURCE-BLENDR",
    "profile_name": "ai-heavy-app",
    "app_type": "B2B SaaS — Vendor Intelligence Platform",
    "complexity_level": "high",
    "guidance_depth": "standard",
    "required_stage_depth": {
      "stage_1": "standard",
      "stage_2": "standard",
      "stage_3": "detailed",
      "stage_4": "standard",
      "stage_5": "standard",
      "stage_6": "detailed",
      "stage_7": "standard",
      "stage_8": "minimal"
    },
    "required_validation_layers": [
      "schema",
      "reference_integrity"
    ],
    "optional_outputs": [
      "Analytics",
      "Collections"
    ],
    "required_outputs": [
      "01-product-foundation.json",
      "02-user-system-map.json",
      "03-workflow-architecture.json",
      "04-product-capabilities.json",
      "05-feature-structure.json",
      "06-product-boundaries.json",
      "07-dependency-map.json",
      "08-mvp-operational-model.json",
      "09-risk-and-constraints.json",
      "10-success-framework.json"
    ],
    "skip_allowed_outputs": [],
    "approval_gates": [
      "stage_decision_brief"
    ]
  },
  "guidance_policy": {
    "complexity_level": "high",
    "guidance_depth": "standard",
    "ask_threshold": "material_decisions",
    "default_inference_allowed": true,
    "approval_required_for": [
      "stage_decision_brief"
    ],
    "max_questions_per_turn": 3
  },
  "source_inputs": {
    "stage_1": [
      "Build-Plans/Stage-1/05-feature-structure.json",
      "Build-Plans/Stage-1/08-mvp-operational-model.json",
      "Build-Plans/Stage-1/09-risk-and-constraints.json"
    ],
    "stage_2": [
      "Build-Plans/Stage-2/03-technical-feasibility.json",
      "Build-Plans/Stage-2/05-risk-validation.json",
      "Build-Plans/Stage-2/06-strategic-positioning.json"
    ],
    "stage_3": [
      "Build-Plans/Stage-3/02-service-architecture.json",
      "Build-Plans/Stage-3/03-data-architecture.json",
      "Build-Plans/Stage-3/04-api-architecture.json",
      "Build-Plans/Stage-3/07-infrastructure-model.json"
    ],
    "stage_4": [
      "Build-Plans/Stage-4/03-screen-system.json",
      "Build-Plans/Stage-4/04-feature-behaviors.json",
      "Build-Plans/Stage-4/05-state-transition-map.json",
      "Build-Plans/Stage-4/07-ui-blueprint-specification.json",
      "Build-Plans/Stage-4/08-design-system-foundation.json",
      "Build-Plans/Stage-4/09-complete-app-blueprint.md"
    ]
  },
  "execution_decision_refs": [
    "ASSUMPTION-S5-001",
    "ASSUMPTION-S5-002",
    "ASSUMPTION-S5-003",
    "ASSUMPTION-S5-004",
    "ASSUMPTION-S5-005"
  ],
  "risks": [
    {
      "risk_id": "RISK-S5-001",
      "risk": "Website scraping behavior and anti-bot variability can destabilize the core import slice.",
      "domain": "integration",
      "severity": "high",
      "likelihood": "high",
      "status": "open",
      "affected_ids": [
        "FEATURE-001",
        "WORKFLOW-001",
        "INTEGRATION-PLAYWRIGHT"
      ],
      "mitigation": "Build a narrow representative-site spike first; persist normalized artifacts; use idempotent per-category jobs and manual entry fallback.",
      "owner_stage": "Stage 5 / Stage 6",
      "evidence_refs": [
        "Build-Plans/Stage-5/03-engineering-dependencies.json"
      ],